{
  "$schema": "http://json-schema.org/draft-07/schema#",
  "$id": "https://engineering-os/contracts/evidence-record.schema.json",
  "title": "EvidenceRecord",
  "description": "A fact produced by an executed check or a completed agent review. Never hand-authored for a command that did not run or a review that did not occur. Consumer: ops.mjs evidence run/review (lib/record-store.mjs), stored one-file-per-record under .claude/ops/evidence/<id>.json.",
  "type": "object",
  "required": ["id", "type", "status", "createdAt"],
  "properties": {
    "id": { "type": "string" },
    "type": { "enum": ["COMMAND", "REVIEW"] },
    "missionId": { "type": "string", "description": "Mission (state.json missionId) the evidence was produced in; orchestrate.mjs done refuses evidence bound to another mission or to none." },
    "status": { "enum": ["PASS", "FAIL", "BLOCKED"] },
    "command": { "type": "string" },
    "reviewer": { "type": "string" },
    "verdict": { "enum": ["PASS", "FAIL"] },
    "summary": { "type": "string" },
    "workspaceFingerprint": { "type": ["string", "null"] },
    "fingerprintStatus": { "type": "string" },
    "head": { "type": ["string", "null"], "description": "git commit SHA at recording time (workspaceFingerprint's head component) -- lets gate-engine.mjs's criteria-fresh-evidence check scoped freshness (lib/hash.mjs pathsChangedSince) against a criterion's relevantPaths instead of only whole-workspace fingerprint equality. Absent/null on evidence recorded before this field existed or when git was unavailable." },
    "createdAt": { "type": "string", "format": "date-time" }
  }
}
