{
  "id": "evid-f0dac11b",
  "createdAt": "2026-09-12T05:42:20.102Z",
  "type": "REVIEW",
  "reviewer": "git-auditor",
  "verdict": "FAIL",
  "status": "FAIL",
  "summary": "Branch=dev, HEAD unchanged, nothing committed/pushed (no push/force-push/reset --hard/clean -f/branch -D evidence; no .orig/conflict-marker files). No secrets in diff (only test fixtures like 'shh'/sk_test_ and config.get() env refs). The ~299-file diff maps plausibly to stated wave domains (billing, artist PT->EN rename per canonical map, migrations, notifications BullMQ dedup, packages/*, eslint/jest tooling) and to disposed findings; pre-session-dirty files (entities.ts, migrations/index.ts, artists.service.ts, contracts.service.ts, hr.service.ts, shares.dto.ts, etc.) are preserved. Spot check: notifications.processor.ts + migration 20260912000001_NotificationsBullmqJobIdUniqueness.ts (registered in index.ts) genuinely implement what find-855bcd84's disposition claims (ON CONFLICT DO NOTHING avoids the 25P02 aborted-transaction re-fetch bug) -- matches. packages/config,observability,schemas,utils tsconfig.json all newly present; jest.config.ts diagnostics no longer blanket warnOnly; eslint.config.js re-enables no-unused-vars as warn -- all confirmed present as specified. BLOCKING ISSUE: find-c620edb3 (CORRIGIDA, resolved 2026-09-11T18:16) explicitly recorded that 14 unreferenced scripts/** were flagged dead-code candidates but were NOT removed in that wave and required human confirmation before removal. Current git status nonetheless shows 9 of those exact files deleted (db-verify-gate.test.mjs, phase2-crud-validation.mjs, post-merge.sh, runtime-visual-validation.mjs, test-gitleaks-docs-coverage.sh, test-pg-backup-cron.sh, verify-db-verify-gate-wiring.test.mjs, verify-migration-source-of-truth.test.mjs, verify-staging-secrets-presence.test.mjs) with no later finding/journal entry recording that the required human authorization was obtained (filed as find-c325f7a3, HIGH). The prior git-auditor PASS (evid-a0a1d0e1, 2026-09-09) is stale for the current workspace (diff has grown substantially since, including this scripts/ deletion which postdates it) and cannot close this criterion. Also: no baseline record exists for this session (record list --kind baseline empty; filed as find-eb3c3040, LOW) -- audited against the initial-turn git status snapshot instead. Recommend restoring the 9 scripts (git checkout -- scripts/<file>) pending explicit human sign-off, or obtaining and recording that sign-off, before this mission is declared done.",
  "workspaceFingerprint": "6d343dfa8e63ff643f895b7c1fc79e29af8ad2f9eb8c5ebbd1835b0f59851c7e",
  "fingerprintStatus": "BOUND"
}
