{
  "id": "evid-10a8d893",
  "createdAt": "2026-09-10T19:56:56.430Z",
  "type": "REVIEW",
  "reviewer": "schema-db-reviewer",
  "verdict": "PASS",
  "status": "PASS",
  "summary": "VERDICT: PASS. Auditoria read-only completa dos ~30 enums PT-BR de packages/types/src/enums.ts contra entities.ts (colunas reais), grep de consumidores (api+web) e grep exaustivo de CHECK constraints em migrations/. Confirmado: nenhuma das ~20 colunas de status alvo tem CHECK constraint (varchar(50) livre) nem policy RLS que referencie valor literal -- risco tecnico de migracao de VALOR e baixo em todos os casos. Pares 'superset hack' investigados com evidencia de leitura/escrita real: LeadStatus contato/em_contato e EventStatus confirmado sao ESTADOS DISTINTOS reais (nao colapsar); TransactionStatus.confirmado e PricingRuleCategory sao mortos/nao usados; WorkStatus/PhonogramStatus em_analise e drift genuino ja normalizado em app (registro-musicas.mapper.ts) para um unico valor persistido. Maior risco real identificado nao e tecnico-DB e sim de superficie: export-query-builder.service expõe o valor cru de status direto em CSV/XLSX sem camada de traducao, entao uma migracao de valor muda o que o usuario baixa. Estrategia expand/backfill/contract/restrict desenhada seguindo precedente real do repo (20260718000015/16 Backfill+RemoveLegacySocietyCodes). Um arquivo de migration-PROPOSTA foi criado (apps/api/src/database/migrations/20260910900001_PROPOSAL_BackfillArtistGoalStatusToEnglish.ts) implementando so o passo 2 (backfill) para o candidato de menor risco (ArtistGoalStatus) -- NAO registrado em migrations/index.ts, NAO executado. 5 findings registrados (categoria E).",
  "workspaceFingerprint": "ab4d174749250d70f4aff728ff0f29a0e6350b238d6555fe02c4bf48e48e391d",
  "fingerprintStatus": "BOUND",
  "head": "37403a32b0fae31b82bd6a5976113a5c07cb1136"
}
